category,sub_category,job_title,province,job_location,job_company,job_industry,job_finance,job_scale,job_welfare,job_salary_range,job_experience,job_education,job_skills,create_time
前端/移动开发,技术美术,资深技术美术工程师,浙江,杭州·滨江区·长河,浙江华娱,游戏,B轮,100-499人,包住，团建聚餐，员工旅游，保底工资，住房补贴，有无线网，生日福利，年终奖，零食下午茶，五险一金，绩效奖金，包吃，宿舍有空调，带薪年假,30-60K·16薪,5-10年,本科,Unity,2024-08-31
前端/移动开发,技术美术,技术美术,浙江,杭州·余杭区·仓前,示缪科技,计算机软件,不需要融资,20-99人,保底工资，五险一金,10-15K,1-3年,本科,"unity,游戏开发,AR,VR,MR,技术美术",2024-08-31
前端/移动开发,技术美术,资深技术美术工程师 (特效向）,浙江,杭州,某大型游戏上市公司,游戏,已上市,10000人以上,包吃，补充医疗保险，定期体检，员工旅游，股票期权，五险一金，餐补，带薪年假，免费班车，交通补助，年终奖，节日福利,45-75K,3-5年,本科,"美术工程师,特效美术,美术资源,特效视觉",2024-08-31
前端/移动开发,技术美术,技术美术,浙江,杭州·余杭区·三墩,倍塔佳,移动互联网,天使轮,0-20人,全勤奖，五险一金,20-25元/时,经验不限,大专,UI,2024-08-31
前端/移动开发,技术美术,UE5技术美术（TA）,浙江,杭州·西湖区·西溪,光音,社交网络与媒体,不需要融资,20-99人,五险一金，定期体检，带薪年假，团建聚餐,15-30K·13薪,3-5年,本科,"UE5,Shader,优化,GPU,Profile",2024-08-31
前端/移动开发,技术美术,游戏场景模型,浙江,杭州·萧山区·西兴,剑魂,游戏,不需要融资,100-499人,员工旅游，全勤奖，通讯补贴，交通补助，年终奖，零食下午茶，补充医疗保险，五险一金，节日福利，带薪年假，周末双休，加班补助,4-8K,1-3年,本科,"3ds Max,Maya,ZBrush",2024-08-31
前端/移动开发,技术美术,资深TA（侧重渲染或者是PCG领域）,浙江,杭州,某500强上市公司,游戏,B轮,1000-9999人,企业年金，加班补助，年终奖，员工旅游，五险一金，定期体检，保底工资，零食下午茶，带薪年假，绩效奖金，股票期权，餐补，节日福利，补充医疗保险,30-60K·15薪,5-10年,本科,"技术美术,侧重渲染或PCG领域,UNITY引擎",2024-08-31
前端/移动开发,技术美术,Unity 技术美术 TA,浙江,杭州·余杭区·仓前,如泽,电子商务,未融资,100-499人,定期体检，五险一金,11-18K,3-5年,本科,技术美术,2024-08-31
前端/移动开发,技术美术,技术美术-动画向(A131969),浙江,杭州·西湖区·西溪,不鸣科技,游戏,不需要融资,100-499人,带薪年假，五险一金，节日福利，生日福利，年终奖，法定节假日三薪，定期体检，节假日加班费，零食下午茶，员工旅游，餐补，团建聚餐,20-35K,3-5年,本科,"FPS,射击游戏",2024-08-31
前端/移动开发,JavaScript,高级前端开发,浙江,杭州,某大型知名互联网上市公司,互联网,已上市,10000人以上,年终奖，生日福利，零食下午茶，五险一金，绩效奖金，股票期权，意外险，高温补贴，通讯补贴，团建聚餐，有无线网，带薪年假，底薪加提成，全勤奖，节日福利，定期体检，补充医疗保险，员工旅游，保底工资,25-50K·16薪,3-5年,本科,React Native,2024-08-31
前端/移动开发,JavaScript,前端开发实习生,浙江,杭州·余杭区·仓前,杭州浙大启真未来...,大数据,20-99人,无,,100-150元/天,5天/周,2个月,"JavaScript,CSS",2024-08-31
前端/移动开发,JavaScript,前端开发工程师 (3D交互）,浙江,杭州·滨江区·长河,VAST,计算机软件,天使轮,20-99人,生日福利，夜班补助，节日福利，五险一金，年终奖，带薪年假，团建聚餐，员工旅游，零食下午茶,12-24K·15薪,1-3年,本科,"JavaScript,WebGL技术,Cocos Creator",2024-08-31
前端/移动开发,JavaScript,游戏前端开发（双休 线上面试）,浙江,杭州,某大型计算机软件公司,计算机软件,不需要融资,10000人以上,节假日加班费，股票期权，绩效奖金，五险一金，加班补助，节日福利，免费班车，餐补，零食下午茶，保底工资，年终奖，定期体检，法定节假日三薪，补充医疗保险，交通补助，员工旅游，意外险，夜班补助,15-30K·14薪,经验不限,本科,"Web前端,游戏前端,小程序,JavaScript,HTML5,Python,,,",2024-08-31
前端/移动开发,JavaScript,通用软件开发工程师,浙江,杭州·滨江区·长河,上海华为技术有限公司,通信/网络设备,不需要融资,10000人以上,员工旅游，免费班车，加班补助，定期体检，节假日加班费，意外险，有无线网，带薪年假，保底工资，生日福利，节日福利，五险一金，补充医疗保险，绩效奖金，团建聚餐，年终奖，股票期权，零食下午茶，法定节假日三薪,20-40K·13薪,1-3年,本科,Linux,2024-08-31
前端/移动开发,JavaScript,前端开发工程师,浙江,杭州·西湖区·文二路,源诚科技,计算机软件,未融资,100-499人,定期体检，团建聚餐，意外险，加班补助，生日福利，节日福利，员工旅游，年终奖，补充医疗保险，零食下午茶，带薪年假，住房补贴，股票期权，有无线网，保底工资，五险一金,10-15K·13薪,1-3年,本科,"React Native,小程序,Web端,CSS,MySQL,Bootstrap,,",2024-08-31
前端/移动开发,JavaScript,前端开发工程师-抖音支付,浙江,杭州·余杭区·五常,北京字节跳动,互联网,不需要融资,10000人以上,五险一金，零食下午茶，免费健身设施，带薪年假，法定节假日三薪，包吃，定期体检，年终奖，加班补助，绩效奖金，意外险，弹性工作制，年度体检，餐饮及下午茶，家属自选保险，补充医疗保险，就近租房补贴，节日礼品，节假日加班费，家庭关爱假,25-50K·15薪,5-10年,本科,"Web前端,CSS,HTML5,Vue/React/Angular,前端开发经验",2024-08-31
前端/移动开发,JavaScript,低代码平台开发工程师,浙江,杭州·拱墅区·上塘,智跑科技,计算机软件,未融资,20-99人,年终奖，五险一金，带薪年假，股票期权,6-7K·13薪,1-3年,本科,"后端,JavaScript,Java,HTML5,计算机/软件工程相关专业,",2024-08-31
前端/移动开发,JavaScript,前端研发工程师—搜索 杭州,浙江,杭州·余杭区·五常,北京有竹居网络技术,互联网,10000人以上,无,,45-75K·15薪,5-10年,本科,"Web前端,JavaScript,Golang,CSS,前端开发经验,",2024-08-31
前端/移动开发,JavaScript,脚本开发工程师（前端可转),浙江,杭州·余杭区·五常,浙江丰沃物联,计算机软件,20-99人,无,,4-8K,在校/应届,本科,"Web前端,JavaScript,Python",2024-08-31
前端/移动开发,JavaScript,H5客户端主程 (MJ001685),浙江,杭州·拱墅区·城西银泰城,游卡,游戏,不需要融资,1000-9999人,带薪年假，餐补，零食下午茶，定期体检，补充医疗保险，年终奖，节日福利，员工旅游，五险一金,30-40K,经验不限,本科,"游戏前端,小程序",2024-08-31
前端/移动开发,JavaScript,客户端开发 js,浙江,杭州·滨江区·长河,华为云计算,计算机服务,不需要融资,10000人以上,五险一金，夜班补助，生日福利，补充医疗保险，意外险，定期体检，带薪年假，保底工资，法定节假日三薪，节假日加班费，加班补助，年终奖，绩效奖金，员工旅游,20-40K,经验不限,本科,"JavaScript,Node.js,Vue/React/Angular",2024-08-31
前端/移动开发,JavaScript,高级前端开发,浙江,杭州,某500强上市公司,互联网,已上市,10000人以上,年终奖，零食下午茶，员工旅游，五险一金，股票期权，免费班车，交通补助，补充医疗保险，节日福利，餐补,35-50K·16薪,3-5年,本科,"JavaScript,CSS,React Native,前端开发经验",2024-08-31
前端/移动开发,JavaScript,高级全栈开发工程师,浙江,杭州·西湖区·西溪,掌银物联网,计算机软件,0-20人,无,,13-15K,3-5年,本科,"Web前端,后端,混合app,JavaScript,HTML5,CSS,,,",2024-08-31
前端/移动开发,JavaScript,electron开发工程师,浙江,杭州·滨江区·长河,淘鱼科技,互联网,未融资,20-99人,年终奖，员工旅游，交通补助，保底工资，底薪加提成，有无线网，餐补，定期体检，五险一金,7-12K,经验不限,大专,"Web前端,后端",2024-08-31
前端/移动开发,JavaScript,系统配置工程师（莱迈医疗—杭州）,浙江,杭州·滨江区·长河,泰格医药,医疗健康,已上市,1000-9999人,定期体检，补充医疗保险，餐补，节日福利，年终奖，通讯补贴，股票期权，员工旅游，六险一金，交通补助，零食下午茶，带薪年假,9-10K,1-3年,本科,"Web前端,JavaScript,前端开发经验,英语读写能力良好",2024-08-31
前端/移动开发,JavaScript,uniapp工程师,浙江,杭州·滨江区·西兴,软程科技,互联网,未融资,20-99人,节日福利，零食下午茶，员工旅游，五险一金,5-7K,1-3年,本科,"HTML,CSS,小程序,Web端,Vue,HTML5",2024-08-31
前端/移动开发,JavaScript,前端开发工程师,浙江,杭州·滨江区·浦沿,五洲工程顾问,建筑设计,未融资,1000-9999人,生日福利，团建聚餐，高温补贴，节日福利，夜班补助，带薪年假，工龄奖，餐补，五险一金,10-15K,1-3年,本科,Web前端,2024-08-31
前端/移动开发,JavaScript,React Native开发,浙江,杭州·滨江区·浦沿,代码狗,计算机软件,不需要融资,20-99人,五险一金，节日福利，年终奖，带薪年假，餐补，员工旅游，定期体检，零食下午茶,75-150元/时,经验不限,大专,React Native,2024-08-31
前端/移动开发,JavaScript,Java开发工程师,浙江,杭州·滨江区·西兴,拓安致胜,通信/网络设备,不需要融资,20-99人,零食下午茶，股票期权,5-6K·13薪,经验不限,本科,"后端,Java,不限,计算机/软件工程相关专业",2024-08-31
前端/移动开发,JavaScript,web开发工程师,浙江,杭州·滨江区·长河,华为,计算机软件,不需要融资,10000人以上,年终奖，绩效奖金，补充医疗保险，节日福利，交通补助，员工旅游，保底工资，节假日加班费，餐补，加班补助，定期体检，五险一金，免费班车，零食下午茶，法定节假日三薪，夜班补助，股票期权，意外险,18-35K·14薪,经验不限,本科,"Web前端,移动web前端,CSS,HTML5,JavaScript,",2024-08-31
前端/移动开发,JavaScript,reactnative开发工程师,浙江,杭州·滨江区·长河,华橙网络,电子商务,未融资,1000-9999人,补充医疗保险，生日福利，定期体检，员工旅游，高温补贴，年终奖，带薪年假，通讯补贴，五险一金，节日福利，餐补，加班补助,18-28K,经验不限,本科,"移动web前端,混合app,JavaScript,Java,React Native,,,",2024-08-31
前端/移动开发,JavaScript,Web安全专家,浙江,杭州·余杭区·五常,浙江智网科技有限公司,互联网,未融资,20-99人,五险一金，定期体检，带薪年假，节日福利,35-50K,5-10年,本科,"Web前端,JavaScript,前端开发经验,反爬",2024-08-31
前端/移动开发,JavaScript,Java开发工程师,浙江,杭州,某互联网公司,互联网,未融资,20-99人,意外险，五险一金,15-25K,经验不限,本科,"Java,C++,JavaScript",2024-08-31
前端/移动开发,JavaScript,JavaScript,浙江,杭州·西湖区·三墩,杭州千数酉辰科技,互联网,0-20人,无,,20-25元/时,1-3年,本科,"Web前端,小程序,混合app,JavaScript,Vue/React/Angular,,,,",2024-08-31
前端/移动开发,JavaScript,web前端开发实习生,浙江,杭州·拱墅区·上塘,天睿云创,大数据,0-20人,无,,150-180元/天,5天/周,3个月,"JavaScript,Vue/React/Angular,React Native,,",2024-08-31
前端/移动开发,JavaScript,JavaScript,浙江,杭州·余杭区·仓前,字节跳动,互联网,D轮及以上,10000人以上,绩效奖金，股票期权，节日礼品，夜班补助，定期体检，五险一金，年度体检，意外险，零食下午茶，餐饮及下午茶，餐补，带薪年假，就近租房补贴，家属自选保险，住房补贴，年终奖，补充医疗保险，家庭关爱假，团建聚餐，免费健身设施,15-30K,经验不限,本科,"Web前端,JavaScript,Vue/React/Angular,HTML5,,",2024-08-31
前端/移动开发,JavaScript,华为计算产品线&德科联合项目前端工程师,浙江,杭州·滨江区·长河,华为,计算机软件,不需要融资,10000人以上,定期体检，法定节假日三薪，意外险，交通补助，节日福利，股票期权，免费班车，餐补，保底工资，夜班补助，五险一金，员工旅游，绩效奖金，年终奖，零食下午茶，节假日加班费，补充医疗保险，加班补助,20-40K·14薪,3-5年,本科,"Web前端,JavaScript",2024-08-31
前端/移动开发,JavaScript,跨平台开发专家/高级专家,浙江,杭州,某大型知名互联网公司,互联网,D轮及以上,10000人以上,节日福利，补充医疗保险，餐补，年终奖，五险一金，零食下午茶，股票期权，定期体检,40-70K·16薪,5-10年,本科,"混合app,React Native,Flutter,Vue/React/Angular",2024-08-31
前端/移动开发,JavaScript,大前端技术合伙人,浙江,杭州·余杭区·仓前,杭州微恺科技,大数据,20-99人,无,团建聚餐，底薪加提成，绩效奖金，有无线网，年终奖，员工旅游,4-5K·24薪,5-10年,本科,"Web前端,JavaScript,HTML5,小程序,,,,",2024-08-31
前端/移动开发,鸿蒙开发工程师,鸿蒙开发（电话面试）,浙江,杭州·余杭区·仓前,上海博为峰,计算机软件,已上市,1000-9999人,五险一金，年度旅游，带薪年假，餐补，节日福利，通讯补贴，员工旅游，交通补助，年终奖，零食下午茶，补充医疗保险，定期体检，全勤奖,11-13K,1-3年,本科,鸿蒙系统开发,2024-08-31
前端/移动开发,鸿蒙开发工程师,鸿蒙应用培训工程师,浙江,杭州·滨江区·浦沿,浙江华为,通信/网络设备,不需要融资,1000-9999人,通讯补贴，定期体检，中长期激励，全额公积金，带薪年假，五险一金，节日福利，补充医疗保险，年终奖,15-30K·15薪,3-5年,本科,"Android开发经验,WEB,IOS",2024-08-31
前端/移动开发,鸿蒙开发工程师,音视频软件工程师,浙江,杭州·滨江区·长河,华为,计算机软件,不需要融资,10000人以上,股票期权，法定节假日三薪，加班补助，零食下午茶，保底工资，五险一金，节假日加班费，餐补，夜班补助，定期体检，绩效奖金，员工旅游，免费班车，年终奖，意外险，交通补助，补充医疗保险，节日福利,15-30K·14薪,经验不限,本科,"音视频/流媒体开发,C++,C,Python,FFmpeg,,,,,",2024-08-31
前端/移动开发,鸿蒙开发工程师,鸿蒙开发工程师(杭州）,浙江,杭州·滨江区·长河,中软国际,计算机软件,已上市,10000人以上,年终奖，定期体检，加班补助，免费班车，五险一金，带薪年假，节日福利，员工旅游，餐补，零食下午茶,11-22K·13薪,1-3年,大专,"ArkTS,ArkUI,鸿蒙",2024-08-31
前端/移动开发,鸿蒙开发工程师,鸿蒙开发（南昌出差）,浙江,杭州,深圳科蓝金信,互联网,不需要融资,1000-9999人,五险一金，补充医疗保险，带薪年假，加班补助，出差补贴，餐补，定期体检，节日福利，零食下午茶,11-18K,3-5年,本科,"HarmonyOS,鸿蒙",2024-08-31
前端/移动开发,鸿蒙开发工程师,高级终端开发工程师/专家（厂商与系统）,浙江,杭州·滨江区·长河,阿里巴巴集团,互联网,已上市,10000人以上,交通补助，餐补，股票期权，免费班车，节日福利，五险一金，零食下午茶，年终奖，补充医疗保险，员工旅游,25-45K·13薪,5-10年,本科,"架构设计/优化,Java,C++,架构设计能力,,,,,",2024-08-31
前端/移动开发,鸿蒙开发工程师,鸿蒙OS开发,浙江,杭州·滨江区·长河,华为终端有限公司,通信/网络设备,不需要融资,10000人以上,员工旅游，年终奖，交通补助，五险一金，住房补贴，定期体检，通讯补贴，零食下午茶，节日福利，股票期权，带薪年假，加班补助，免费班车，补充医疗保险,20-40K·15薪,经验不限,本科,"Java,C++,JavaScript",2024-08-31
前端/移动开发,鸿蒙开发工程师,鸿蒙开发,浙江,杭州·滨江区·长河,软通动力,计算机软件,已上市,10000人以上,补充医疗保险，通讯补贴，交通补助，定期体检，节日福利，五险一金，免费班车，加班补助，零食下午茶，带薪年假，生日福利，团建活动,11-18K,1-3年,大专,"鸿蒙,ArkTs",2024-08-31
前端/移动开发,鸿蒙开发工程师,Android,浙江,杭州,某500强上市公司,互联网,1000-9999人,无,,25-40K,3-5年,本科,Android客户端产品研发,2024-08-31
前端/移动开发,鸿蒙开发工程师,鸿蒙开发工程师,浙江,杭州·余杭区·仓前,法本,计算机软件,已上市,10000人以上,节日福利，零食下午茶，五险一金，带薪年假，加班补助，企业文化，员工旅游，定期体检,11-17K,3-5年,大专,"鸿蒙开发,C++,前端开发,JAVA开发,安卓开发",2024-08-31
前端/移动开发,鸿蒙开发工程师,客户端sdk开发工程师（OD）,浙江,杭州·滨江区·长河,华为,计算机软件,不需要融资,10000人以上,节日福利，意外险，保底工资，法定节假日三薪，股票期权，交通补助，餐补，免费班车，夜班补助，节假日加班费，加班补助，零食下午茶，员工旅游，补充医疗保险，定期体检，五险一金，绩效奖金，年终奖,20-40K·14薪,经验不限,本科,C++,2024-08-31
前端/移动开发,鸿蒙开发工程师,前端开发工程师,浙江,杭州,某大型计算机软件公司,计算机软件,A轮,100-499人,意外险，有无线网，节日福利，绩效奖金，零食下午茶，团建聚餐，补充公积金，年终奖，股票期权，定期体检，生日福利，员工旅游，法定节假日三薪，补充医疗保险，五险一金，带薪年假,30-60K·16薪,经验不限,本科,"Kotlin,Java,HTML5",2024-08-31
前端/移动开发,鸿蒙开发工程师,前端/鸿蒙开发工程师,浙江,杭州·滨江区·长河,杭州华为云计算,计算机软件,不需要融资,1000-9999人,节日福利，五险一金，股票期权，加班补助，年终奖，节假日加班费，法定节假日三薪，有无线网，意外险，绩效奖金，夜班补助，零食下午茶，补充医疗保险，定期体检，生日福利,20-40K,经验不限,本科,"JavaScript,React,Node.js,计算机/软件工程相关专业,,",2024-08-31
前端/移动开发,鸿蒙开发工程师,鸿蒙应用开发工程师,浙江,杭州·余杭区·仓前,阿里巴巴集团,互联网,已上市,10000人以上,五险一金，交通补助，餐补，免费班车，节日福利，股票期权，零食下午茶，补充医疗保险，年终奖，员工旅游,25-45K,1-3年,本科,鸿蒙,2024-08-31
前端/移动开发,鸿蒙开发工程师,鸿蒙工程师,浙江,杭州·临平区·临平,浙江春风动力股份...,汽车研发/制造,已上市,1000-9999人,节日福利，加班补助，带薪年假，年终奖，定期体检，五险一金，餐补,20-30K·14薪,5-10年,本科,鸿蒙 鸿蒙应用 app,2024-08-31
前端/移动开发,鸿蒙开发工程师,鸿蒙系统高级技术工程师,浙江,杭州,某大型知名互联网公司,互联网,未融资,10000人以上,交通补助，员工旅游，带薪年假，餐补，绩效奖金，包吃，住房补贴，法定节假日三薪，五险一金，免费班车，零食下午茶，节假日加班费，定期体检，加班补助，年终奖，团建聚餐，股票期权，意外险，补充医疗保险，节日福利,26-50K·16薪,3-5年,本科,"Android客户端产品研发,研发流程优化,C++,Java,,,,,",2024-08-31
前端/移动开发,鸿蒙开发工程师,C/C++,浙江,杭州·滨江区·长河,杭州华为企业通信技术,计算机硬件,未融资,1000-9999人,意外险，补充医疗保险，定期体检，加班补助，节假日加班费，年终奖，法定节假日三薪，夜班补助，股票期权，带薪年假，节日福利，绩效奖金，底薪加提成，保底工资，五险一金,15-30K,经验不限,本科,"C++,C,OpenGL,图形开发经验",2024-08-31
前端/移动开发,鸿蒙开发工程师,鸿蒙/Win/Android/MAC/iOS 客户端开发,浙江,杭州·滨江区·长河,上海华为技术有限公司,通信/网络设备,不需要融资,10000人以上,定期体检，员工旅游，补充医疗保险，意外险，保底工资，有无线网，绩效奖金，团建聚餐，零食下午茶，法定节假日三薪，生日福利，年终奖，加班补助，股票期权，免费班车，五险一金，节假日加班费，节日福利，带薪年假,20-40K·16薪,经验不限,本科,"C/C++,Java,JavaScript,前端开发经验",2024-08-31
前端/移动开发,鸿蒙开发工程师,鸿蒙/Win/Android/MAC/iOS 客户端开发,浙江,杭州·滨江区·长河,华为云计算,计算机服务,不需要融资,10000人以上,生日福利，加班补助，夜班补助，带薪年假，保底工资，节假日加班费，定期体检，五险一金，补充医疗保险，员工旅游，绩效奖金，意外险，年终奖，法定节假日三薪,20-40K·16薪,经验不限,本科,"C++,C",2024-08-31
前端/移动开发,鸿蒙开发工程师,鸿蒙开发工程师,浙江,杭州·拱墅区·上塘,南京翼海云峰软件技术,互联网,100-499人,无,,11-22K,1-3年,大专,"HarmonyOS,Arkts",2024-08-31
前端/移动开发,鸿蒙开发工程师,鸿蒙应用开发工程师,浙江,杭州·滨江区·长河,无锡科艾思信息,互联网,未融资,100-499人,,12-16K,3-5年,大专,"Android开发经验,IOS,鸿蒙开发,typescript",2024-08-31
前端/移动开发,鸿蒙开发工程师,高级客户端开发-鸿蒙项目,浙江,杭州,某500强上市公司,互联网,已上市,10000人以上,交通补助，五险一金，零食下午茶，餐补，节日福利，免费班车，补充医疗保险，年终奖，股票期权，员工旅游,40-70K·16薪,5-10年,本科,"Kotlin,Flutter,React Native,iOS,JavaScript,Android",2024-08-31
前端/移动开发,鸿蒙开发工程师,鸿蒙开发工程师,浙江,杭州·上城区·近江,易诚互动,互联网,不需要融资,1000-9999人,五险一金，节日福利，餐补，加班补助，员工旅游，带薪年假，通讯补贴，零食下午茶，定期体检,13-18K,3-5年,本科,"HarmonyOS,ArkTS",2024-08-31
前端/移动开发,鸿蒙开发工程师,鸿蒙开发,浙江,杭州·余杭区·五常,上海帆立信息科技...,计算机软件,不需要融资,100-499人,带薪年假，补充医疗保险，免费班车，年终奖，五险一金，加班补助，通讯补贴，餐补，全勤奖，住房补贴,12-18K,3-5年,本科,"安卓,IOS,鸿蒙",2024-08-31
前端/移动开发,鸿蒙开发工程师,软件工程师,浙江,杭州·余杭区·仓前,阿里巴巴集团,互联网,已上市,10000人以上,餐补，节日福利，免费班车，员工旅游，股票期权，零食下午茶，交通补助，五险一金，补充医疗保险，年终奖,30-60K·16薪,经验不限,本科,"Android客户端产品研发,架构设计/优化,研发流程优化,Java,,,,,",2024-08-31
前端/移动开发,鸿蒙开发工程师,鸿蒙应用开发工程师,浙江,杭州·滨江区·长河,育菡科技,计算机软件,未融资,100-499人,餐补，带薪年假，节日福利，包吃，住房补贴，年终奖，五险一金,12-18K,1-3年,大专,ArkTS,2024-08-31
前端/移动开发,鸿蒙开发工程师,鸿蒙应用开发工程师,浙江,杭州·上城区·近江,南华期货,证券/期货,已上市,500-999人,定期体检，节日福利，节假日加班费，零食下午茶，五险一金，夜班补助，有无线网，团建聚餐，团建活动，工龄奖，通讯补贴，餐补，加班补助，免费工装，交通补助，带薪年假，高温补贴，生日福利，生日礼物，年终奖,12-18K·14薪,1-3年,本科,"鸿蒙,前端开发",2024-08-31
前端/移动开发,鸿蒙开发工程师,Andriod研发工程师,浙江,杭州·西湖区·西溪,阿里云,互联网,不需要融资,10000人以上,定期体检，免费班车，带薪年假，餐补，年终奖，绩效奖金，五险一金，节日福利,24-45K·16薪,1-3年,本科,"Java,ReactNative,C++,Android客户端产品研发,Flutter",2024-08-31
前端/移动开发,鸿蒙开发工程师,终端工程师（iOS/Android/鸿蒙/web）,浙江,杭州,某500强上市公司,互联网,已上市,10000人以上,年终奖，免费班车，节日福利，股票期权，交通补助，员工旅游，五险一金，补充医疗保险，餐补，零食下午茶,15-30K,1-3年,本科,前端开发经验,2024-08-31
前端/移动开发,鸿蒙开发工程师,客户端开发(Android/iOS/鸿蒙/C++)体验技术,浙江,杭州,某知名互联网公司,互联网,1000-9999人,无,,30-60K·16薪,1-3年,本科,"Android客户端产品研发,架构设计/优化,Flutter,,,,",2024-08-31
测试,测试工程师,测试工程师（杭州）,浙江,杭州·拱墅区·古墩路,文渊阁科技,互联网,未融资,100-499人,五险一金，带薪年假，零食下午茶，节日福利,10-15K,3-5年,本科,"Linux,APP/WEB自动化,软件测试流程",2024-08-31
