category,sub_category,job_title,province,job_location,job_company,job_industry,job_finance,job_scale,job_welfare,job_salary_range,job_experience,job_education,job_skills,create_time
运维/技术支持,技术文档工程师,技术文档工程师,浙江,杭州·余杭区·仓前,弈芯,半导体/芯片,A轮,20-99人,团建聚餐，意外险，生日福利，零食下午茶，股票期权，绩效奖金，节日福利，节假日加班费，带薪年假，有无线网，员工旅游，五险一金，年终奖，定期体检，法定节假日三薪，保底工资，补充医疗保险,12-24K·14薪,3-5年,本科,"书面英语,EDA,芯片/半导体/集成电路",2024-08-31
运维/技术支持,技术文档工程师,技术文档工程师,浙江,杭州·余杭区·仓前,杭州悦数,计算机软件,A轮,20-99人,定期体检，股票期权，年终奖，团建聚餐，餐补，零食下午茶，带薪年假，12天带薪年假，节日福利，六险一金,15-28K·13薪,经验不限,本科,"技术文档,技术写作",2024-08-31
运维/技术支持,技术文档工程师,技术文档工程师,浙江,杭州·余杭区·仓前,神络医疗,医疗器械,B轮,20-99人,五险一金，节日福利，零食下午茶，年终奖，带薪年假，员工旅游，补充医疗保险，股票期权，意外险，定期体检,11-18K·13薪,1-3年,本科,"研发文档,硬件文档,软件文档",2024-08-31
运维/技术支持,技术文档工程师,文档工程师,浙江,杭州·余杭区·五常,杭州小质数字技术,企业服务,20-99人,无,年终奖，补充医疗保险，五险一金，带薪年假，团建聚餐，定期体检，零食下午茶,12-24K·15薪,1-3年,本科,文档工程师,2024-08-31
运维/技术支持,技术文档工程师,技术文档,浙江,杭州·上城区·望江,诚品科技,计算机软件,未融资,20-99人,,8-13K,1-3年,本科,网络安全,2024-08-31
运维/技术支持,技术文档工程师,技术文档工程师,浙江,杭州·西湖区·西溪,涂鸦智能,互联网,已上市,1000-9999人,员工旅游，加班补助，带薪年假，交通补助，年终奖，定期体检，每年outing，通讯补贴，每月团建费，股票期权，五险一金，节日福利,12-20K,3-5年,本科,"技术文档,翻译,英文文档,云开发,嵌入式,中文文档,,",2024-08-31
运维/技术支持,技术文档工程师,资料开发 -英语专八,浙江,杭州·滨江区·长河,紫光云数,计算机软件,不需要融资,1000-9999人,交通补助，零食下午茶，通讯补贴，年终奖，带薪年假，餐补，免费班车，加班补助，节日福利，定期体检，意外险，五险一金,9-14K,1-3年,本科,英语八级,2024-08-31
运维/技术支持,技术文档工程师,萤石-文档开发工程师-杭州,浙江,杭州·滨江区·长河,海康威视,计算机软件,已上市,10000人以上,团建聚餐，通讯补贴，餐补，五险一金，生日福利，高温补贴，带薪年假，免息住房借款，免费班车，股票期权，定期体检，补充医疗保险，年终奖，交通补助,12-18K·15薪,3-5年,本科,技术文档,2024-08-31
运维/技术支持,技术文档工程师,研发端--文控专员,浙江,杭州·余杭区·仓前,欧凯车业,智能硬件,A轮,500-999人,年终奖，股票期权，加班补助，餐补，全勤奖，五险一金，带薪年假,7-12K,1-3年,本科,文件档案管理知识,2024-08-31
运维/技术支持,技术文档工程师,文档工程师,浙江,杭州·滨江区·彩虹城,锘崴科技,信息安全,B轮,100-499人,节日福利，人才公寓，交通补助，股票期权，高温补贴，带薪年假，生日福利，康体活动，年终奖，高温补贴，餐补，员工旅游，零食下午茶，团建聚餐，五险一金，学习基金，定期体检，意外险,10-15K,1-3年,本科,"技术文档,项目交付文档",2024-08-31
运维/技术支持,技术文档工程师,技术文档开发工程师,浙江,杭州·萧山区·西兴,极氪智能科技,汽车研发/制造,A轮,10000人以上,交通补助，五险一金，节日福利，通讯补贴，高温补贴，带薪年假，餐补，生日福利，住房补贴，定期体检，年终奖，股票期权，补充医疗保险，工龄奖,15-27K,3-5年,本科,"技术文档开发工程师,用户手册开发,可维修性分析,,,",2024-08-31
运维/技术支持,技术文档工程师,英文文档工程师(J10092),浙江,杭州·滨江区·长河,华睿科技,计算机软件,未融资,1000-9999人,生日福利，节日福利，带薪年假，餐补，零食下午茶，高温补贴，员工旅游，定期体检，年终奖，通讯补贴，补充医疗保险，五险一金,10-15K·14薪,3-5年,本科,英文,2024-08-31
运维/技术支持,技术文档工程师,研发技术工程师,浙江,杭州·滨江区·长河,华昱欣,光伏,未融资,500-999人,通讯补贴，员工旅游，年终奖，团建聚餐，补充医疗保险，高温补贴，零食下午茶，餐补，带薪年假，生日福利，节假日加班费，股票期权，加班补助，意外险，定期体检，节日福利，绩效奖金，五险一金,15-25K·14薪,3-5年,本科,"光伏,逆变器,储能",2024-08-31
运维/技术支持,技术文档工程师,技术文档工程师,浙江,杭州·西湖区·西溪,REDPLUS,广告营销,不需要融资,20-99人,夜班补助，团建聚餐，员工旅游，全勤奖，五险一金，保底工资，绩效奖金，定期体检，年终奖，有无线网，节假日加班费，带薪年假，加班补助,15-25K,5-10年,本科,"架构优化,运维开发,技术服务,容器,计算机",2024-08-31
运维/技术支持,技术文档工程师,文档工程师,浙江,杭州·西湖区·西溪,柏科数据,计算机软件,不需要融资,100-499人,员工旅游，补充医疗保险，定期体检，年终奖，股票期权，节日福利，五险一金，通讯补贴，带薪年假，零食下午茶,10-15K,3-5年,本科,文档工程师,2024-08-31
运维/技术支持,技术文档工程师,文档开发,浙江,杭州·西湖区·转塘,政采云,互联网,不需要融资,1000-9999人,股票期权，节日福利，补充医疗保险，带薪年假，通讯补贴，员工旅游，交通补助，加班补助，年终奖，餐补，定期体检，五险一金,14-18K,5-10年,本科,文档体系建设,2024-08-31
运维/技术支持,技术文档工程师,实习生-飞书企业效能顾问,浙江,杭州·西湖区·浙大紫金港,佳书科技,企业服务,不需要融资,0-20人,保底工资，绩效奖金，底薪加提成，团建聚餐，零食下午茶，年终奖，五险一金,140-160元/天,4天/周,3个月,"数字化,飞书,项目管理,产品,大牛同事",2024-08-31
运维/技术支持,技术文档工程师,技术文档工程师,浙江,杭州·西湖区·文二路,耐可思博,计算机软件,D轮及以上,0-20人,五险一金，定期体检，加班补助，股票期权,7-12K,经验不限,本科,技术文档工程师,2024-08-31
人工智能,图像算法,阿里集团-图像生成-图像编辑以及可控生成,浙江,杭州·余杭区·仓前,阿里巴巴集团,互联网,已上市,10000人以上,五险一金，节日福利，餐补，交通补助，员工旅游，免费班车，年终奖，零食下午茶，补充医疗保险，股票期权,30-60K·16薪,3-5年,本科,"图像处理库（OpenCV等）,Python,深度学习,机器学习,,",2024-08-31
人工智能,图像算法,XR算法专家-3D真人重建,浙江,杭州,某500强上市公司,互联网,已上市,10000人以上,年终奖，节日福利，餐补，五险一金，加班补助，股票期权，带薪年假，补充医疗保险，定期体检，免费班车，交通补助，员工旅游,40-70K·16薪,5-10年,本科,"C/C++,机器学习,人像算法,图像生成,三维重建",2024-08-31
人工智能,图像算法,图像算法工程师(ISP-Tuning),浙江,杭州·滨江区·长河,虹软科技,计算机软件,已上市,500-999人,五险一金，年终奖，补充医疗保险，节日福利，定期体检，股票期权，全勤奖，餐补，包吃，带薪年假,20-30K·13薪,经验不限,本科,"C/C++,深度学习,传统图像算法,Tuning,ISP-pipeline,",2024-08-31
人工智能,图像算法,图像工程师,浙江,杭州·滨江区·浦沿,浙江大华,互联网,已上市,10000人以上,住房免息贷款，五险一金，年终奖，加班补助，补充医疗保险，交通补助，带薪年假，员工旅游，餐补，定期体检，通讯补贴，包吃，免费班车，节日福利,15-25K·14薪,1-3年,本科,"ISP/3A算法,MATLAB,嵌入式开发,C/C++,图像调优",2024-08-31
人工智能,图像算法,V部门-AIGC算法-杭州/深圳,浙江,杭州,北京某大型互联网公司,互联网,D轮及以上,10000人以上,夜班补助，家庭关爱假，家属自选保险，年度体检，就近租房补贴，住房补贴，股票期权，餐饮及下午茶，带薪年假，零食下午茶，免费健身设施，意外险，补充医疗保险，年终奖，绩效奖金，定期体检，团建聚餐，节日礼品，餐补，五险一金,75-100K·15薪,5-10年,本科,"大模型算法,多模态算法,图像生成,发表算法相关优秀论文,",2024-08-31
人工智能,图像算法,智能算法负责人,浙江,杭州,某500强上市公司,互联网,已上市,1000-9999人,带薪年假，节日福利，年终奖，员工旅游，补充医疗保险，餐补，定期体检，零食下午茶，股票期权，通讯补贴，五险一金,30-50K·15薪,5-10年,本科,"C/C++,图像处理库（OpenCV等）,MATLAB,深度学习,,,,",2024-08-31
人工智能,图像算法,图像算法工程师（调试方向）,浙江,杭州,杭州某中型医疗健康公司,医疗健康,未融资,100-499人,节日福利，年终奖，零食下午茶，通讯补贴，免费班车，高温补贴，团建聚餐，五险一金，带薪年假，员工旅游，股票期权，餐补，加班补助，补充医疗保险，定期体检，生日福利,25-30K·14薪,5-10年,本科,"图像处理库（OpenCV等）,图像调试",2024-08-31
人工智能,图像算法,机器视觉应用工程师,浙江,杭州·滨江区·长河,海康威视,计算机软件,已上市,10000人以上,餐补，五险一金，高温补贴，免费班车，年终奖，定期体检，生日福利，交通补助，免息住房借款，股票期权，补充医疗保险，团建聚餐，带薪年假，通讯补贴,16-30K·15薪,1-3年,本科,机器视觉,2024-08-31
人工智能,图像算法,高级视觉工程师,浙江,杭州·临平区·塘栖,深圳市燕麦科技,机械设备/机电/重工,已上市,500-999人,补充医疗保险，通讯补贴，定期体检，股票期权，五险一金，带薪年假，员工旅游，年终奖，节日福利，定制化培训,20-30K·14薪,5-10年,本科,"HALCON,工业/缺陷检测,团队管理经验,引导定位,,",2024-08-31
人工智能,图像算法,计算机视觉人脸识别-全国居家,浙江,杭州,某大型区块链大数据公司（上市公司）,大数据,不需要融资,1000-9999人,年终奖，意外险，零食下午茶，补充医疗保险，带薪年假，团建聚餐，股票期权，员工旅游，生日福利，五险一金,40-70K·14薪,5-10年,本科,"C/C++,深度学习,目标检测,目标跟踪,人脸识别,,",2024-08-31
人工智能,图像算法,图像算法工程师,浙江,杭州,某大型机械设备公司,机械设备/机电/重工,未融资,500-999人,,25-40K·14薪,5-10年,本科,"C/C++,图像生成,三维重建",2024-08-31
人工智能,图像算法,昇腾FAE（杭州算法）,浙江,杭州,某知名互联网公司,电子商务,未融资,20-99人,交通补助，带薪年假，年终奖，五险一金,15-25K·14薪,1-3年,本科,"C/C++,Python,图像处理库（OpenCV等）,深度学习,,,,,,,,,,",2024-08-31
人工智能,图像算法,视觉算法工程师,浙江,杭州·余杭区·未来科技城,靖安科技,互联网,天使轮,20-99人,月度聚餐，带薪年假，免费购书，五险一金，股票期权，节日福利，试用期全薪，生日福利，定期体检，异地入住住宿，零食下午茶，年终奖，上下班不打卡，加班补助，结婚生子福利，定期团建，年假7-20天，餐补，周末双休，五险一金全额,20-30K·13薪,1-3年,本科,"Python,MATLAB,分布式训练,深度学习,机器学习,,,,,",2024-08-31
人工智能,图像算法,图像算法专家(三维模型生成方向),浙江,杭州,某知名互联网上市公司,互联网,已上市,1000-9999人,带薪年假，高温补贴，五险一金，零食下午茶，交通补助，餐补，绩效奖金，法定节假日三薪，团建聚餐,40-60K,3-5年,本科,"大模型算法,传统图像算法,三维重建,团队管理经验",2024-08-31
人工智能,图像算法,视觉算法高级专家,浙江,杭州,某大型知名互联网金融公司,互联网金融,10000人以上,无,,60-90K·16薪,5-10年,本科,"机器学习,传统图像算法,cv,多媒体算法,边缘计算",2024-08-31
人工智能,图像算法,机器视觉应用工程师,浙江,杭州,丹陌智能,仪器仪表/工业自动化,0-20人,无,,5-7K,经验不限,大专,"Python,图像处理库（OpenCV等）,深度学习,目标检测,,",2024-08-31
人工智能,图像算法,视觉应用工程师,浙江,杭州·余杭区·仓前,杭州智感科技,仪器仪表/工业自动化,不需要融资,20-99人,五险一金，年终奖，员工旅游，带薪年假，全勤奖，餐补，通讯补贴，节日福利,4-7K,经验不限,本科,"HALCON,深度学习,目标检测,图像生成,传统图像算法",2024-08-31
人工智能,图像算法,图像算法工程师,浙江,杭州,上海泰宇信息技术...,大数据,未融资,100-499人,五险一金，年终奖，证书补贴，节日福利，通讯补贴，交通补助，餐补，零食下午茶，带薪年假,20-35K·13薪,3-5年,本科,"Java,图像处理库（OpenCV等）,深度学习,OCR,,,",2024-08-31
人工智能,图像算法,视觉算法工程师,浙江,杭州·临平区·崇贤,浙江吾知科技,互联网,未融资,20-99人,五险一金，高温补贴，团建聚餐，带薪年假，股票期权,30-60K,3-5年,本科,"C/C++,深度学习,点云算法,目标跟踪,融合感知算法",2024-08-31
人工智能,图像算法,视觉算法工程师,浙江,杭州·西湖区·西溪,企企赢,企业服务,不需要融资,20-99人,绩效奖金，带薪年假，定期体检，餐补，全勤奖，底薪加提成，保底工资，团建聚餐，意外险，五险一金，年终奖,14-16K·13薪,1-3年,本科,"图像处理库（OpenCV等）,机器学习,OCR,人像算法,,,",2024-08-31
人工智能,图像算法,机器视觉工程师,浙江,杭州·余杭区·仓前,利珀,通信/网络设备,B轮,100-499人,节日福利，员工旅游，零食下午茶，高温补贴，带薪年假，加班补助，绩效奖金，定期体检，年终奖，五险一金,13-25K,1-3年,本科,"C/C++,HALCON,图像处理库（OpenCV等）,,,,,,,,,,",2024-08-31
人工智能,图像算法,多模态算法工程师,浙江,杭州,某大型互联网上市公司,互联网,已上市,10000人以上,五险一金，免费班车，股票期权，零食下午茶，员工旅游，节日福利，餐补，交通补助，补充医疗保险，年终奖,30-60K·16薪,1-3年,本科,"C/C++,Python,图像处理库（OpenCV等）,大模型算法,,,",2024-08-31
人工智能,图像算法,图像算法工程师,浙江,杭州,当贝网络,互联网,C轮,500-999人,交通补助，股票期权，节日福利，全勤奖，零食下午茶，员工旅游，生日福利，餐补，意外险，五险一金，带薪年假，年终奖，加班补助，团建聚餐,20-30K,1-3年,本科,"C/C++,Python,深度学习,目标检测,",2024-08-31
人工智能,图像算法,头部大厂AIGC算法专家-多模态30-150W,浙江,杭州,某大型知名互联网上市公司,互联网,已上市,10000人以上,补充医疗保险，五险一金，年终奖，员工旅游，股票期权，交通补助，餐补，零食下午茶，节日福利，免费班车,25-50K·16薪,3-5年,本科,"Python,HALCON,Shell,深度学习,机器学习,大模型算法,,,,,,,",2024-08-31
人工智能,图像算法,机器视觉主管（上市公司40-60万）,浙江,杭州,某小型人力资源服务公司,人力资源服务,不需要融资,0-20人,节日福利，全勤奖，五险一金，定期体检，年终奖,25-40K·15薪,3-5年,本科,"C/C++,图像处理库（OpenCV等）,HALCON,深度学习,,,,",2024-08-31
人工智能,图像算法,机器视觉应用工程师,浙江,杭州·余杭区·仓前,升恒科技,自动化设备,天使轮,100-499人,节日福利，节假日加班费，股票期权，通讯补贴，绩效奖金，免费工装，加班补助，年终奖，五险一金，补充医疗保险,9-14K·14薪,5-10年,大专,"C/C++,VisionPro,深度学习,优秀开源项目经历,Halcon,",2024-08-31
人工智能,图像算法,图像算法工程师,浙江,杭州·萧山区·钱江世纪城,思元智能,自动化设备,不需要融资,100-499人,补充医疗保险，带薪年假，加班补助，五险一金，股票期权，员工旅游，餐补，节日福利，年终奖,9-14K,1-3年,本科,"图像处理库（OpenCV等）,HALCON,传统图像算法",2024-08-31
人工智能,图像算法,AIGC算法专家,浙江,杭州,某大型知名互联网公司,互联网,B轮,10000人以上,五险一金，免费班车，餐补，定期体检，员工旅游，带薪年假，法定节假日三薪，股票期权，年终奖，补充医疗保险，住房补贴，团建聚餐,30-60K·16薪,3-5年,本科,"Python,深度学习,多模态算法,图像生成,,",2024-08-31
人工智能,图像算法,OCR算法工程师（紧急/不加班）,浙江,杭州,某电子商务公司,电子商务,20-99人,无,,25-50K·15薪,经验不限,本科,"C/C++,Python,图像处理库（OpenCV等）,深度学习,,,,,,,,",2024-08-31
人工智能,图像算法,序列工程师,浙江,杭州,深圳某中型大数据医疗科技公司,大数据,C轮,100-499人,股票期权，补充医疗保险，节日福利，餐补，交通补助，员工旅游，五险一金，生日福利，零食下午茶，带薪年假，年终奖，绩效奖金，团建聚餐,20-35K·15薪,3-5年,本科,"C/C++,Python,MATLAB,三维重建,,,,",2024-08-31
人工智能,大模型算法,大模型算法专家,浙江,杭州,某大型互联网支付平台公司,互联网,B轮,10000人以上,团建聚餐，带薪年假，住房补贴，五险一金，定期体检，餐补，法定节假日三薪，免费班车，年终奖，股票期权，补充医疗保险，员工旅游,40-70K·16薪,5-10年,本科,"大模型,算法",2024-08-31
人工智能,大模型算法,高级模型工程师（银行 正编，不卷）,浙江,杭州,某知名银行公司,银行,1000-9999人,无,带薪年假，节假日加班费，交通补助，高温补贴，通讯补贴，餐补，员工旅游，定期体检，绩效奖金，五险一金，节日福利，生日福利，年终奖，底薪加提成，意外险，企业年金，补充医疗保险,30-45K·14薪,经验不限,本科,"大模型,深度学习,SQL,银行,大数据,决策树类,,",2024-08-31
人工智能,大模型算法,领域大模型Agent算法专家,浙江,杭州,某500强上市公司,电子商务,D轮及以上,1000-9999人,带薪年假，定期体检，五险一金，包吃，加班补助，年终奖，餐补,40-70K·16薪,5-10年,本科,"预训练,agent,NLP,机器学习,模型微调",2024-08-31
人工智能,大模型算法,大模型算法工程师,浙江,杭州,某大型知名移动互联网公司,移动互联网,10000人以上,无,,50-70K·14薪,3-5年,本科,"生成式AI,大模型算法,Langchain,llama-index,智能客服,,,",2024-08-31
人工智能,大模型算法,大模型解决方案架构,浙江,杭州,某大型企业服务公司,企业服务,1000-9999人,无,,40-70K·16薪,5-10年,本科,"大模型,LLM",2024-08-31
人工智能,大模型算法,大模型训推优化,浙江,杭州·西湖区·西溪,讯盟科技,互联网,C轮,100-499人,五险一金，年终奖，股票期权，带薪年假，节日福利，零食下午茶,30-50K·16薪,5-10年,本科,"软件架构师,大模型框架",2024-08-31
人工智能,大模型算法,高级nlp算法工程师,浙江,杭州,某500强上市公司,移动互联网,D轮及以上,1000-9999人,带薪年假，定期体检，补充医疗保险，餐补，五险一金，交通补助，年终奖，员工旅游，节日福利,30-60K,3-5年,本科,"大模型,算法,NLP,算法工程师",2024-08-31
人工智能,大模型算法,大模型算法专家-AI导购服务,浙江,杭州,某知名电子商务公司,电子商务,1000-9999人,无,,35-65K,经验不限,本科,"大模型,pytorch,tensorfow,attention,transformer,,,",2024-08-31
人工智能,大模型算法,人工智能（24届可投 六险一金 周末双休）,浙江,杭州·滨江区·长河,万宝盛华企业管理...,生活服务(O2O),已上市,1000-9999人,零食下午茶，带薪年假，节日福利，补充医疗保险，五险一金,11-22K,1-3年,本科,"大模型,自然语言处理",2024-08-31
人工智能,大模型算法,大模型算法工程师,浙江,杭州,某大型知名互联网上市公司,互联网,已上市,10000人以上,年终奖，节日福利，餐补，交通补助，带薪年假，定期体检，补充医疗保险，通讯补贴，员工旅游，五险一金，股票期权，零食下午茶，免费班车,20-40K·14薪,5-10年,本科,大模型算法,2024-08-31
人工智能,大模型算法,智能服务策略算法专家,浙江,杭州,某大型知名互联网上市公司,互联网,已上市,10000人以上,餐补，交通补助，五险一金，补充医疗保险，员工旅游，免费班车，年终奖，股票期权，节日福利，零食下午茶,40-70K,5-10年,本科,"智能客服NLP算法开发,智能对话算法策略建模,",2024-08-31
人工智能,大模型算法,大语言模型算法专家（杭州/上海）,浙江,杭州,某大型知名互联网公司,互联网,D轮及以上,10000人以上,定期体检，补充医疗保险，包吃，意外险，通讯补贴，夜班补助，住房补贴，交通补助，员工旅游，全勤奖，带薪年假，节假日加班费，免费班车，餐补，股票期权，年终奖，零食下午茶，加班补助，节日福利，五险一金,40-70K·16薪,3-5年,本科,"NLP,大语言模型",2024-08-31
人工智能,大模型算法,大模型算法专家,浙江,杭州,某大型互联网上市公司,互联网,已上市,10000人以上,补充医疗保险，节日福利，年终奖，股票期权，零食下午茶，交通补助，餐补，员工旅游，免费班车，五险一金,30-50K·15薪,5-10年,本科,大模型,2024-08-31
人工智能,大模型算法,nlp高级算法工程师,浙江,杭州,某500强上市公司,互联网,B轮,1000-9999人,五险一金，定期体检，补充医疗保险，节日福利，零食下午茶，带薪年假，加班补助，年终奖，团建聚餐，生日福利，法定节假日三薪，股票期权，购车优惠，意外险，加班免费打车，免费加班餐，打车优惠,40-55K·14薪,经验不限,本科,pytorch/tensorflow,2024-08-31
人工智能,大模型算法,AI算法工程师（应用大模型/银行正编岗位）,浙江,杭州,某大型银行公司,银行,不需要融资,10000人以上,股票期权，补充医疗保险，加班补助，带薪年假，员工旅游，年终奖，通讯补贴，定期体检，带薪年假，节日福利，五险一金,20-35K,经验不限,本科,"Python,Java,应用大模型算法,银行/金融",2024-08-31
人工智能,大模型算法,智能算法工程师（不卷）早八晚五,浙江,杭州,某知名企业,人力资源服务,已上市,1000-9999人,定期体检，年终奖，带薪年假，住房补贴，交通补助，员工旅游，节日福利，餐补，股票期权，补充医疗保险，加班补助,30-50K·13薪,经验不限,本科,深度学习,2024-08-31
人工智能,大模型算法,大模型算法专家,浙江,杭州,某500强上市公司,互联网,B轮,10000人以上,年终奖，团建聚餐，法定节假日三薪，带薪年假，餐补，免费班车，五险一金，补充医疗保险，定期体检，员工旅游，住房补贴，股票期权,40-70K·16薪,5-10年,本科,"预训练模型,多模态,深度学习,NLP,pytorch,tensorflow,",2024-08-31
人工智能,大模型算法,智能算法工程师,浙江,杭州,某大型银行公司,银行,1000-9999人,无,定期体检，绩效奖金，餐补，高温补贴，带薪年假，节假日加班费，员工旅游，五险一金，补充医疗保险，底薪加提成，交通补助，节日福利，年终奖，意外险，生日福利，企业年金，通讯补贴,30-50K,经验不限,本科,算法 模型,2024-08-31
人工智能,大模型算法,大模型算法专家,浙江,杭州,某500强上市公司,互联网,B轮,10000人以上,补充医疗保险，定期体检，住房补贴，餐补，股票期权，法定节假日三薪，五险一金，免费班车，带薪年假，年终奖，团建聚餐，员工旅游,70-100K,3-5年,本科,大模型算法,2024-08-31
人工智能,大模型算法,反洗钱监控,浙江,杭州,某500强上市公司,互联网,已上市,10000人以上,员工旅游，餐补，五险一金，节日福利，年终奖，股票期权，零食下午茶，交通补助，免费班车，补充医疗保险,35-55K,10年以上,本科,"反洗钱,大数据模型,建模",2024-08-31
人工智能,大模型算法,软件工程师,浙江,杭州·滨江区·长河,杭州华为企业通信技术,计算机硬件,未融资,1000-9999人,节日福利，五险一金，股票期权，加班补助，补充医疗保险，夜班补助，绩效奖金，底薪加提成，年终奖，带薪年假，定期体检，意外险，保底工资，节假日加班费，法定节假日三薪,15-30K·14薪,3-5年,本科,"C,C++,java",2024-08-31
